{
  "$schema": "https://schemas.globalgovernanceframeworks.org/iaf/1.2/implementation-and-adaptation-v1.2-specification.schema.json",
  "framework_id": "IAF/1.2",
  "title": "GGF Implementation & Adaptation Framework",
  "version": "1.2",
  "date": "2026-08-06",
  "status": "document_and_machine_compatible",
  "legal_character": "Implementation-support, method-selection, pilot, transition, and learning interface; not a source of jurisdiction, consent, public law, emergency command, funding authority, or scaling permission.",
  "source_lineage": {
    "CIS/0.2.1": {
      "filename": "constitutional-interface-specification-v0.2.1.md",
      "sha256": "2ab06be70d568be82efde2ccbcc3f8df48f37308fab3ccf116ac3efe4c167bfc",
      "bytes": 81323
    },
    "GMEAIA/0.2.1": {
      "filename": "governance-method-experiment-adoption-implementation-authority-interface-specification-v0.2.1.md",
      "sha256": "8cdaf8c316b50b251721a824124e47b1ad30787e9f5281d7fade0f4360bfe5d1",
      "bytes": 90094
    },
    "META-GOVERNANCE/1.6": {
      "filename": "integrated-meta-governance-v1.6.md",
      "sha256": "cf1cd81a681b6b94ef4107cee35dfdabb3a991f6472c75d87fa7218a229466ba",
      "bytes": 87518
    },
    "IAF/1.2": {
      "filename": "implementation-and-adaptation-v1.2.md",
      "sha256": "9b18e19e028352896635366ada96db416bbf089ac4d67247bdca1f12c1274e67",
      "bytes": 113447
    }
  },
  "constitutional_interface": "CIS/0.2.1",
  "controlling_interface": "GMEAIA/0.2.1",
  "event_transport": "EGP/1.2",
  "tool_commons": "IMT/0.9",
  "institutional_transition": "IRF/1.0",
  "coordination_interface": "META-GOVERNANCE/1.6",
  "non_authority_clause": "Context is not competence. Assessment is not jurisdiction. A tool is not a mandate. Adoption is not activation. Pilot success is not permission to scale. Compatibility is not legitimacy. Conformance is not success.",
  "action_classes": [
    {
      "id": "A",
      "scope": "Constitution and role boundary"
    },
    {
      "id": "B",
      "scope": "Engagement and invitation"
    },
    {
      "id": "C",
      "scope": "Affected parties and Indigenous authority"
    },
    {
      "id": "D",
      "scope": "Context evidence and conditions"
    },
    {
      "id": "E",
      "scope": "Journey and tool selection"
    },
    {
      "id": "F",
      "scope": "Cultural adaptation and advisory review"
    },
    {
      "id": "G",
      "scope": "Pilot design and protected-domain review"
    },
    {
      "id": "H",
      "scope": "Consent and authority"
    },
    {
      "id": "I",
      "scope": "Adoption, activation, and implementation"
    },
    {
      "id": "J",
      "scope": "Funding and participation support"
    },
    {
      "id": "K",
      "scope": "Data, technology, and dashboards"
    },
    {
      "id": "L",
      "scope": "Monitoring, incident, and correction"
    },
    {
      "id": "M",
      "scope": "Learning and public memory"
    },
    {
      "id": "N",
      "scope": "Scaling and permanent adoption"
    },
    {
      "id": "O",
      "scope": "Emergency and cross-framework handoff"
    },
    {
      "id": "P",
      "scope": "Termination, remedy, closure, and stewardship"
    }
  ],
  "pilot_types": [
    {
      "id": "acceptability",
      "primary_question": "Can affected participants understand, access, and willingly use the intervention?",
      "success_supports": "Acceptability within the tested population and conditions",
      "does_not_establish": [
        "feasibility",
        "causal effectiveness",
        "system effect",
        "durability"
      ]
    },
    {
      "id": "feasibility",
      "primary_question": "Can the intervention operate safely with the tested resources and constraints?",
      "success_supports": "Bounded operational feasibility",
      "does_not_establish": [
        "causal mechanism",
        "net benefit",
        "transferability",
        "ordinary affordability"
      ]
    },
    {
      "id": "mechanism",
      "primary_question": "Does the claimed causal mechanism operate under specified conditions?",
      "success_supports": "Evidence about the mechanism",
      "does_not_establish": [
        "system-wide effect",
        "political durability",
        "scale"
      ]
    },
    {
      "id": "operational",
      "primary_question": "Can authorized ordinary actors deliver the intervention reliably?",
      "success_supports": "Delivery capability under tested conditions",
      "does_not_establish": [
        "net system effect",
        "long-term institutionalization"
      ]
    },
    {
      "id": "system_effect",
      "primary_question": "Does the relevant condition improve, including distributional and external effects?",
      "success_supports": "Bounded system-effect evidence",
      "does_not_establish": [
        "transferability to new contexts",
        "ordinary ownership"
      ]
    },
    {
      "id": "institutionalization",
      "primary_question": "Can a competent ordinary owner maintain, adapt, fund, govern, and close the function after exceptional support ends?",
      "success_supports": "Durability within the tested institutional context",
      "does_not_establish": [
        "universal scalability",
        "permanent superiority"
      ]
    }
  ],
  "complexity_bands": [
    {
      "id": "B1",
      "description": "Single low-risk tool",
      "authority_consequence": "None; appropriate internal authority and consent still required."
    },
    {
      "id": "B2",
      "description": "Multi-tool pilot",
      "authority_consequence": "None; cumulative dependency and administrative-burden review required."
    },
    {
      "id": "B3",
      "description": "Full local stack",
      "authority_consequence": "None; public or protected-domain effects require specialized authority."
    },
    {
      "id": "B4",
      "description": "Multi-community or multi-jurisdiction proposal",
      "authority_consequence": "No automatic progression; new jurisdiction and authorization required."
    }
  ],
  "consequence_profiles": [
    {
      "id": "CP0",
      "name": "Exploratory and non-consequential",
      "examples": "public education, optional brainstorming, non-operative drafting, simulation, or demonstration.",
      "core": "one compact non-operative record identifying the method or artifact, responsible actor, authority effect, and non-activation status. Data and closure semantics are added where material."
    },
    {
      "id": "CP1",
      "name": "Voluntary bounded practice",
      "examples": null,
      "core": "actor and method; voluntary scope; consent, refusal, and withdrawal; implementation responsibility; stop and expiry; complaint and correction route."
    },
    {
      "id": "CP2",
      "name": "Operational or consequential action",
      "examples": null,
      "core": "constituting authority; affected parties; causal responsibility; authorization and activation; implementation ownership and dependencies; monitoring and review; challenge and remedy; closure and unresolved-duty custody."
    },
    {
      "id": "CP3",
      "name": "Protected-domain or constitutional action",
      "examples": null,
      "core": "`CP2` plus `GMEAIA-56` or `GMEAIA-57` and the controlling specialized interface. Ordinary GMEAIA conformance is never sufficient by itself."
    }
  ],
  "handoff_states": [
    "offered",
    "acknowledged",
    "accepted",
    "partially_accepted",
    "capacity_limited",
    "refused",
    "deferred",
    "referred",
    "timed_out",
    "misrouted",
    "constitutional_gap",
    "returned",
    "closed"
  ],
  "authority_formation_states": [
    "retained",
    "delegated",
    "transferred",
    "concurrent",
    "jointly_constituted",
    "absent"
  ],
  "response_duty_effects": [
    "legal",
    "contractual",
    "charter_internal",
    "voluntary_commitment",
    "advisory",
    "none"
  ],
  "common_header_fields": [
    {
      "number": 1,
      "field": "record_id"
    },
    {
      "number": 2,
      "field": "record_type"
    },
    {
      "number": 3,
      "field": "schema_version"
    },
    {
      "number": 4,
      "field": "created_at"
    },
    {
      "number": 5,
      "field": "effective_at"
    },
    {
      "number": 6,
      "field": "expires_at"
    },
    {
      "number": 7,
      "field": "status"
    },
    {
      "number": 8,
      "field": "normative_force"
    },
    {
      "number": 9,
      "field": "authority_effect"
    },
    {
      "number": 10,
      "field": "action_class"
    },
    {
      "number": 11,
      "field": "source_framework_id"
    },
    {
      "number": 12,
      "field": "source_framework_version"
    },
    {
      "number": 13,
      "field": "source_record_ids"
    },
    {
      "number": 14,
      "field": "supersedes"
    },
    {
      "number": 15,
      "field": "superseded_by"
    },
    {
      "number": 16,
      "field": "actor_id"
    },
    {
      "number": 17,
      "field": "actor_type"
    },
    {
      "number": 18,
      "field": "office_or_role"
    },
    {
      "number": 19,
      "field": "representation_source"
    },
    {
      "number": 20,
      "field": "technical_credential_refs"
    },
    {
      "number": 21,
      "field": "constituting_instrument"
    },
    {
      "number": 22,
      "field": "legal_power"
    },
    {
      "number": 23,
      "field": "jurisdiction_territorial"
    },
    {
      "number": 24,
      "field": "jurisdiction_personal"
    },
    {
      "number": 25,
      "field": "jurisdiction_subject_matter"
    },
    {
      "number": 26,
      "field": "jurisdiction_temporal"
    },
    {
      "number": 27,
      "field": "affected_party_refs"
    },
    {
      "number": 28,
      "field": "affected_indigenous_nation_refs"
    },
    {
      "number": 29,
      "field": "protected_domain_flags"
    },
    {
      "number": 30,
      "field": "consent_record_refs"
    },
    {
      "number": 31,